{
  "version": "2.0",
  "has_ciclo": false,
  "facultades": [
    "Facultad de Arquitectura",
    "Facultad de Derecho",
    "Facultad de Psicología"
  ],
  "carreras": [
    "Arquitectura",
    "Derecho",
    "Psicología"
  ],
  "ciclos": [],
  "facultad_carrera": {
    "Facultad de Psicología": [
      "Psicología"
    ],
    "Facultad de Derecho": [
      "Derecho"
    ],
    "Facultad de Arquitectura": [
      "Arquitectura"
    ]
  }
}